{"comparison":{"hideDeltaWhenNotComparable":true,"requirePreviousKrxTradingDay":true,"requireSameConfigHash":true,"requireSameMetricsVersion":true,"requireSameUniverseVersionForRankDelta":true,"requireSameUniverseVersionForScoreDelta":true},"composite":{"combine":"weighted_mean","missingPolicy":"withhold_composite_and_ranking","requiredMetrics":["momentum","activity","value","riskAdjusted"],"weights":{"activity":0.25,"momentum":0.25,"riskAdjusted":0.25,"value":0.25}},"configHashAlgorithm":"sha256","effectiveMarketDate":null,"engineVersion":"2.5.1","id":"ornscore-metrics","market":"XKRX","metrics":{"activity":{"denominatorTradingDays":20,"input":"share_volume","minimumVolumePoints":20,"missingPolicy":"propagate_null","numeratorTradingDays":5,"scoreMapping":{"domain":"volume_activity_ratio","segments":[{"anchorRatio":0.0,"anchorScore":10.0,"maxExclusive":0.5,"minInclusive":null,"slopePerRatio":0.0},{"anchorRatio":0.5,"anchorScore":10.0,"maxExclusive":1.0,"minInclusive":0.5,"slopePerRatio":80.0},{"anchorRatio":1.0,"anchorScore":50.0,"maxExclusive":3.0,"minInclusive":1.0,"slopePerRatio":25.0},{"anchorRatio":3.0,"anchorScore":100.0,"maxExclusive":null,"minInclusive":3.0,"slopePerRatio":0.0}],"type":"piecewise_linear"}},"momentum":{"input":"adjusted_close","lookbacksTradingDays":{"r1m":21,"r3m":63,"r6m":126},"minimumPricePoints":127,"missingPolicy":"propagate_null","scoreMapping":"universe_percentile","weights":{"r1m":0.3,"r3m":0.4,"r6m":0.3}},"riskAdjusted":{"annualizationFactor":252,"fixedAnnualHurdleRate":0.035,"input":"adjusted_close_daily_returns","minimumPricePoints":253,"missingPolicy":"propagate_null","requiredDailyReturns":252,"scoreMapping":"universe_percentile","stddev":"population"},"value":{"combine":"mean","componentScore":"hundred_minus_percentile","industryAdjustmentInComposite":false,"inputs":["per","pbr"],"missingPolicy":"propagate_null","validity":{"pbr":"positive","per":"positive"}}},"percentile":{"maxScore":100.0,"method":"average_rank","minScore":0.0,"singleValueScore":50.0,"tieHandling":"average_rank"},"quality":{"publishBlockers":["latest_market_date_mismatch","source_date_mismatch","duplicate_ticker","score_out_of_range","composite_invariant_failure","metrics_version_config_mismatch","config_hash_failure","universe_snapshot_missing","published_row_count_mismatch","generated_docs_config_mismatch"]},"rounding":{"displayIntegerFromStoredScore":true,"mode":"ROUND_HALF_UP","rawStorageDecimalsMinimum":6,"storedScoreDecimals":1},"semanticRules":{"activityStates":[{"id":"VERY_LOW","maxExclusive":0.5,"minInclusive":null},{"id":"DECREASED","maxExclusive":0.8,"minInclusive":0.5},{"id":"NORMAL","maxExclusive":1.2,"minInclusive":0.8},{"id":"INCREASED","maxExclusive":1.5,"minInclusive":1.2},{"id":"SIGNIFICANT_INCREASE","maxExclusive":2.0,"minInclusive":1.5},{"id":"SURGE","maxExclusive":null,"minInclusive":2.0}],"directionFlatThresholdPct":1.0,"riskEfficiencyBands":[{"id":"LOW","maxExclusive":30.0,"minInclusive":0.0},{"id":"NEUTRAL","maxExclusive":70.0,"minInclusive":30.0},{"id":"HIGH","maxExclusive":100.0001,"minInclusive":70.0}]},"status":"shadow_draft","statusSeverityOrder":["NORMAL","LIMITED","DEGRADED","OUTAGE"],"universe":{"id":"ornscore_kr_v1","requireSameVersionForRankDelta":true,"requireSameVersionForScoreDelta":true,"versionStrategy":"sha256_of_normalized_constituents_and_eligibility"}}